{
  "ibex_decision": "direct_ielr",
  "schema_version": 1,
  "work_order": "I001",
  "decision": {
    "value": "NO-GO",
    "status": "final_no_go",
    "basis": "repository_evidence",
    "review_state": "validated",
    "date": "2026-08-19",
    "revision": "18d328979b0f7b5a015f6498528a4cc94ef08beb",
    "revision_role": "reviewed repository evidence immediately before dossier publication"
  },
  "follow_on": {
    "direct_ielr_implementation_authorized": false,
    "i002_authorized": false
  },
  "policy": {
    "go_rule": "all_conditions_required",
    "go_conditions": [
      {
        "id": "representative-practical-canonical-cost",
        "status": "not_satisfied",
        "observed": "one measured real grammar; at least two representative real grammars are required"
      },
      {
        "id": "ielr-required-by-representative-grammars",
        "status": "not_satisfied",
        "observed": "zero real IELR-required workloads and zero semantically reviewed conflict removals"
      },
      {
        "id": "algorithm-and-specification-owner",
        "status": "not_satisfied",
        "observed": "no accepted owner is recorded"
      },
      {
        "id": "noncanonical-verification-plan",
        "status": "not_satisfied",
        "observed": "no accepted scale-independent verification plan; current verification requires full canonical LR(1)"
      },
      {
        "id": "maintenance-budget-accepted",
        "status": "not_satisfied",
        "observed": "no accepted maintenance budget is recorded"
      }
    ],
    "no_go_rule": "any_condition_sufficient",
    "no_go_conditions": [
      {
        "id": "no-real-ielr-required-workload",
        "status": "satisfied",
        "observed": "zero real workloads currently require IELR"
      },
      {
        "id": "canonical-lr1-completes-within-current-measured-budget",
        "status": "satisfied",
        "observed": "the one measured real grammar completes canonical LR(1) without observed exhaustion; no broader budget claim is made"
      },
      {
        "id": "lr1-or-grammar-rewrite-is-simpler",
        "status": "not_assessable",
        "observed": "there is no concrete real conflict case on which to compare alternatives"
      },
      {
        "id": "verifier-still-enumerates-full-canonical-collection",
        "status": "satisfied",
        "observed": "default and strict ielr1 verification both enumerate full canonical LR(1)"
      },
      {
        "id": "only-state-count-benefit",
        "status": "satisfied",
        "observed": "no semantic conflict-removal benefit is established; structural state and item counts alone do not justify direct IELR"
      }
    ]
  },
  "observations": {
    "measured_real_grammars": 1,
    "verified_public_checkouts": 0,
    "real_ielr_required_workloads": 0,
    "semantically_reviewed_conflict_removals": 0,
    "current_real_workload": {
      "id": "ibex-frontend",
      "lr0_states": 227,
      "lr0_items": 633,
      "canonical_states": 456,
      "canonical_items": 10482,
      "final_states": 227,
      "unresolved_ielr_conflicts": 0
    },
    "canonical_scale_cost": {
      "status": "unresolved",
      "current_verified_workflow": "default_and_strict_ielr1_verification_enumerate_full_canonical_lr1",
      "observed_exhaustions": 0,
      "scope": "completion is established only for the one measured real grammar; no general scale bound is claimed"
    }
  },
  "verification_gaps": {
    "ielr_adequacy": "not_verified",
    "split_witnesses": "not_verified",
    "conflict_preservation": "not_verified"
  },
  "reconsideration_triggers": [
    {
      "id": "representative-real-grammars",
      "required_evidence": "at least two verified representative real grammars"
    },
    {
      "id": "material-canonical-cost",
      "required_evidence": "material canonical state or item cost, or observed bounded exhaustion, on those grammars"
    },
    {
      "id": "meaningful-ielr-need",
      "required_evidence": "IELR removes semantically reviewed meaningful conflicts on those grammars"
    },
    {
      "id": "scale-independent-verification",
      "required_evidence": "a bounded verification plan does not make full canonical LR(1) enumeration mandatory"
    },
    {
      "id": "algorithm-and-specification-owner",
      "required_evidence": "an identified owner accepts the algorithm and specification"
    },
    {
      "id": "maintenance-budget",
      "required_evidence": "the ongoing implementation, verification, review, and maintenance budget is accepted"
    }
  ],
  "legal_provenance": {
    "design_lineage": "independent_design_from_papers_and_specifications",
    "permitted_design_inputs": [
      "papers",
      "specifications"
    ],
    "gpl_implementation_source_used": false,
    "gpl_implementation_source_translated": false,
    "rule": "future direct IELR design must remain independent; GPL implementation source must not be inspected or translated"
  },
  "evidence_identity": {
    "profile_capture_base_revision": "4c595b006e14acf64d6f1f1def43bf0cee730cd9",
    "profile_bound_paths_sha256": "898c3529b4a4e318d718a1641b1f8530f4208e72179f0c8748fe6a4b3358b81e",
    "profile_implementation_sha256": "91160673bb0d540a738a698781b283d332729c5afafee6a601b14928b1ed3239",
    "v001_revision": "f9d2c54eb4b27fc5ffe798bb0b29d038d97ee35c",
    "sources": [
      {
        "id": "h005-human-report",
        "path": "docs/records/profiles/construction-profiling.md",
        "sha256": "e69e88b9a474fb07b30d1e29a353e0d80edcced7d538b9ca3cf47413d087034c",
        "role": "H005 thresholds, observations, NO-GO rationale, and reconsideration evidence"
      },
      {
        "id": "h005-machine-evidence",
        "path": "tool/profile/evidence/construction-profile-v1.json",
        "sha256": "96c6bc2cf39048c4c6719e90e090272f528cdd5344ebc6281db9da6ecdd3b46b",
        "role": "machine-readable workload measurements, thresholds, decision, and capture provenance"
      },
      {
        "id": "h005-evidence-schema",
        "path": "schema/construction-profile-v1.schema.json",
        "sha256": "0cdac1514e965800701286084c18411a190ac424527ebf9de2163cbc204b4462",
        "role": "closed H005 evidence contract"
      },
      {
        "id": "v001-trust-boundary",
        "path": "docs/policy/verifier-trust-boundary.md",
        "sha256": "7615c078e856bad5b3b8b6606b39dc1b35fedc385da5ab7bbecd1c71b1376b93",
        "role": "verifier reference cost, assurance boundary, and explicit IELR non-goals"
      },
      {
        "id": "v001-reference-collection",
        "path": "lib/ibex/verify/reference_collection.rb",
        "sha256": "d07e900652c61ddd942380d49edce0a3c811605cd82490c1e0e6db54010746fb",
        "role": "independent reference collection implementation reviewed by V001"
      },
      {
        "id": "v001-verifier",
        "path": "lib/ibex/verify/verifier.rb",
        "sha256": "934ae84111581d2edd4230b06733f259bbf72839042a67c62d20558973af2e2e",
        "role": "current verifier checks reviewed by V001"
      }
    ],
    "sources_sha256": "ec0cfbddc45dd03bf7d53d4918119a820c802d9a6bf33837d8886848628085e6"
  }
}
